[
  {
    "name": "INT8",
    "category": "integer",
    "bits_total": 8,
    "signed": true,
    "range": "-128 to 127",
    "values": "256",
    "structure": {
      "sign_bits": 1,
      "exponent_bits": null,
      "mantissa_bits": null,
      "bias": null,
      "specials": { "zeros": "true", "infinities": false, "nans": false, "subnormals": false }
    },
    "bit_split": "SBBBBBBB",
    "governance": { "type": "de-facto", "owner": "ISO C/C++", "status": "standardized", "notes": "Two's complement" },
    "language_support": [
      { "language": "C", "native_support": "int8_t", "header": "<stdint.h>", "standard": "C99+", "notes": "signed char is also 8-bit but int8_t is explicit" },
      { "language": "C++", "native_support": "int8_t", "header": "<cstdint>", "standard": "C++11+", "notes": "Also std::int8_t" },
      { "language": "C#", "native_support": "sbyte", "namespace": "System", "version": ".NET 1.0+", "notes": "Signed byte" },
      { "language": "Java", "native_support": "byte", "version": "1.0+", "notes": "Always signed in Java" },
      { "language": "Go", "native_support": "int8", "package": "builtin", "version": "1.0+", "notes": "Guaranteed 8-bit signed" },
      { "language": "Rust", "native_support": "i8", "version": "1.0+", "notes": "Primitive type" },
      { "language": "Python", "native_support": "none", "library": "NumPy", "type": "np.int8", "notes": "Via NumPy array dtype" },
      { "language": "Haskell", "native_support": "Int8", "module": "Data.Int", "notes": "Explicitly 8-bit signed" },
      { "language": "JavaScript", "native_support": "none", "library": "TypedArray", "type": "Int8Array", "standard": "ES6+", "notes": "Array buffer view" },
      { "language": "Excel Lambda", "native_support": "none", "notes": "No explicit 8-bit integer support" },
      { "language": "CUDA", "native_support": "char", "version": "all", "notes": "signed char is 8-bit" },
      { "language": "Maple", "native_support": "none", "notes": "Uses arbitrary precision integers" },
      { "language": "Julia", "native_support": "Int8", "version": "0.1+", "notes": "Primitive type" },
      { "language": "Wolfram", "native_support": "none", "notes": "Uses arbitrary precision, but can specify via ByteArray" },
      { "language": "R", "native_support": "none", "notes": "Integers are 32-bit, no native 8-bit" }
    ],
    "links": [
      { "text": "C stdint.h", "url": "https://en.cppreference.com/w/c/types/integer" }
    ]
  },
  {
    "name": "UINT8",
    "category": "integer",
    "bits_total": 8,
    "signed": false,
    "range": "0 to 255",
    "values": "256",
    "structure": {
      "sign_bits": 0,
      "exponent_bits": null,
      "mantissa_bits": null,
      "bias": null,
      "specials": { "zeros": "true", "infinities": false, "nans": false, "subnormals": false }
    },
    "bit_split": "BBBBBBBB",
    "governance": { "type": "de-facto", "owner": "ISO C/C++", "status": "standardized", "notes": "Unsigned binary" },
    "language_support": [
      { "language": "C", "native_support": "uint8_t", "header": "<stdint.h>", "standard": "C99+", "notes": "unsigned char also works" },
      { "language": "C++", "native_support": "uint8_t", "header": "<cstdint>", "standard": "C++11+", "notes": "std::uint8_t" },
      { "language": "C#", "native_support": "byte", "namespace": "System", "version": ".NET 1.0+", "notes": "Unsigned 8-bit" },
      { "language": "Java", "native_support": "none", "notes": "No unsigned byte, use byte with unsigned operations" },
      { "language": "Go", "native_support": "uint8", "package": "builtin", "version": "1.0+", "notes": "Also 'byte' is alias" },
      { "language": "Rust", "native_support": "u8", "version": "1.0+", "notes": "Primitive type" },
      { "language": "Python", "native_support": "none", "library": "NumPy", "type": "np.uint8", "notes": "Via NumPy" },
      { "language": "Haskell", "native_support": "Word8", "module": "Data.Word", "notes": "Unsigned 8-bit" },
      { "language": "JavaScript", "native_support": "none", "library": "TypedArray", "type": "Uint8Array", "standard": "ES6+", "notes": "Array buffer view" },
      { "language": "Excel Lambda", "native_support": "none", "notes": "No explicit support" },
      { "language": "CUDA", "native_support": "unsigned char", "version": "all", "notes": "8-bit unsigned" },
      { "language": "Maple", "native_support": "none", "notes": "Arbitrary precision only" },
      { "language": "Julia", "native_support": "UInt8", "version": "0.1+", "notes": "Primitive type" },
      { "language": "Wolfram", "native_support": "none", "notes": "Via ByteArray" },
      { "language": "R", "native_support": "none", "library": "raw", "notes": "raw type is unsigned byte" }
    ],
    "links": []
  },
  {
    "name": "INT16",
    "category": "integer",
    "bits_total": 16,
    "signed": true,
    "range": "-32768 to 32767",
    "values": "65536",
    "structure": {
      "sign_bits": 1,
      "exponent_bits": null,
      "mantissa_bits": null,
      "bias": null,
      "specials": { "zeros": "true", "infinities": false, "nans": false, "subnormals": false }
    },
    "bit_split": "SBBBBBBBBBBBBBB",
    "governance": { "type": "de-facto", "owner": "ISO C/C++", "status": "standardized", "notes": "Two's complement" },
    "language_support": [
      { "language": "C", "native_support": "int16_t", "header": "<stdint.h>", "standard": "C99+", "notes": "short is typically 16-bit" },
      { "language": "C++", "native_support": "int16_t", "header": "<cstdint>", "standard": "C++11+", "notes": "std::int16_t" },
      { "language": "C#", "native_support": "short", "namespace": "System", "version": ".NET 1.0+", "notes": "System.Int16" },
      { "language": "Java", "native_support": "short", "version": "1.0+", "notes": "Always 16-bit signed" },
      { "language": "Go", "native_support": "int16", "package": "builtin", "version": "1.0+", "notes": "Guaranteed 16-bit" },
      { "language": "Rust", "native_support": "i16", "version": "1.0+", "notes": "Primitive type" },
      { "language": "Python", "native_support": "none", "library": "NumPy", "type": "np.int16", "notes": "Via NumPy" },
      { "language": "Haskell", "native_support": "Int16", "module": "Data.Int", "notes": "Explicitly 16-bit" },
      { "language": "JavaScript", "native_support": "none", "library": "TypedArray", "type": "Int16Array", "standard": "ES6+", "notes": "Array buffer view" },
      { "language": "Excel Lambda", "native_support": "none", "notes": "No explicit support" },
      { "language": "CUDA", "native_support": "short", "version": "all", "notes": "16-bit signed" },
      { "language": "Maple", "native_support": "none", "notes": "Arbitrary precision" },
      { "language": "Julia", "native_support": "Int16", "version": "0.1+", "notes": "Primitive type" },
      { "language": "Wolfram", "native_support": "none", "notes": "Arbitrary precision default" },
      { "language": "R", "native_support": "none", "notes": "No native 16-bit integer" }
    ],
    "links": []
  },
  {
    "name": "UINT16",
    "category": "integer",
    "bits_total": 16,
    "signed": false,
    "range": "0 to 65535",
    "values": "65536",
    "structure": {
      "sign_bits": 0,
      "exponent_bits": null,
      "mantissa_bits": null,
      "bias": null,
      "specials": { "zeros": "true", "infinities": false, "nans": false, "subnormals": false }
    },
    "bit_split": "BBBBBBBBBBBBBBBB",
    "governance": { "type": "de-facto", "owner": "ISO C/C++", "status": "standardized", "notes": "Unsigned" },
    "language_support": [
      { "language": "C", "native_support": "uint16_t", "header": "<stdint.h>", "standard": "C99+", "notes": "unsigned short" },
      { "language": "C++", "native_support": "uint16_t", "header": "<cstdint>", "standard": "C++11+", "notes": "std::uint16_t" },
      { "language": "C#", "native_support": "ushort", "namespace": "System", "version": ".NET 1.0+", "notes": "System.UInt16" },
      { "language": "Java", "native_support": "char", "version": "1.0+", "notes": "char is unsigned 16-bit for Unicode" },
      { "language": "Go", "native_support": "uint16", "package": "builtin", "version": "1.0+", "notes": "Unsigned 16-bit" },
      { "language": "Rust", "native_support": "u16", "version": "1.0+", "notes": "Primitive type" },
      { "language": "Python", "native_support": "none", "library": "NumPy", "type": "np.uint16", "notes": "Via NumPy" },
      { "language": "Haskell", "native_support": "Word16", "module": "Data.Word", "notes": "Unsigned 16-bit" },
      { "language": "JavaScript", "native_support": "none", "library": "TypedArray", "type": "Uint16Array", "standard": "ES6+", "notes": "Array buffer" },
      { "language": "Excel Lambda", "native_support": "none", "notes": "No explicit support" },
      { "language": "CUDA", "native_support": "unsigned short", "version": "all", "notes": "16-bit unsigned" },
      { "language": "Maple", "native_support": "none", "notes": "Arbitrary precision" },
      { "language": "Julia", "native_support": "UInt16", "version": "0.1+", "notes": "Primitive type" },
      { "language": "Wolfram", "native_support": "none", "notes": "Arbitrary precision" },
      { "language": "R", "native_support": "none", "notes": "No native support" }
    ],
    "links": []
  },
  {
    "name": "INT32",
    "category": "integer",
    "bits_total": 32,
    "signed": true,
    "range": "-2147483648 to 2147483647",
    "values": "4294967296",
    "structure": {
      "sign_bits": 1,
      "exponent_bits": null,
      "mantissa_bits": null,
      "bias": null,
      "specials": { "zeros": "true", "infinities": false, "nans": false, "subnormals": false }
    },
    "bit_split": "S + 31 bits",
    "governance": { "type": "de-facto", "owner": "ISO C/C++", "status": "standardized", "notes": "Most common integer size" },
    "language_support": [